id,short_effect,effect
236,Power increases when this move has less PP,"up to a maximum of 200."",""Inflicts [regular damage]{mechanic:regular-damage}. Power is determined by the [PP]{mechanic:pp} remaining for this move, after its [PP]{mechanic:pp} cost is deducted. Ignores [accuracy]{mechanic:accuracy} and [evasion]{mechanic:evasion} modifiers."
237,Prevents target from restoring its HP for five turns.,"For the next five turns, the target may not use any moves that only restore [HP]{mechanic:hp}, and move effects that heal the target are disabled. Moves that steal [HP]{mechanic:hp} may still be used, but will only inflict damage and not heal the target."
238,Power increases against targets with more HP remaining,"up to a maximum of 121 power."",""Inflicts [regular damage]{mechanic:regular-damage}. Power directly relates to the target's relative remaining [HP]{mechanic:hp}, given by `1 + 120 * current HP / max HP`, to a maximum of 121."
239,User swaps Attack and Defense.,The user's original [Attack]{mechanic:attack} and [Defense]{mechanic:defense} are swapped.
240,Nullifies target's ability until it leaves battle.,The target's ability is disabled as long as it remains on the [field]{mechanic:field}.
241,Prevents the target from scoring critical hits for five turns.,"For five turns, opposing Pokémon cannot score [critical hits]{mechanic:critical-hit}."
242,Uses the target's move against it before it attacks,"with power increased by half."",""If the target has selected a damaging move this turn, the user will copy that move and use it against the target, with a 50% increase in power."
243,Uses the target's last used move.,"Uses the last move that was used successfully by any Pokémon, including the user."
244,User swaps Attack and Special Attack changes with the target.,User swaps its [Attack]{mechanic:attack} and [Special Attack]{mechanic:special-attack} [stat modifiers]{mechanic:stat-modifiers} modifiers with the target.
245,User swaps Defense and Special Defense changes with the target.,User swaps its [Defense]{mechanic:defense} and [Special Defense]{mechanic:special-defense} modifiers with the target.
246,Power increases against targets with more raised stats,"up to a maximum of 200."",""Inflicts [regular damage]{mechanic:regular-damage}. Power starts at 60 and is increased by 20 for every [stage]{mechanic:stage} any of the target's stats has been raised, capping at 200. [Accuracy]{mechanic:accuracy} and [evasion]{mechanic:evasion} modifiers do not increase this move's power."
247,Can only be used after all of the user's other moves have been used.,"Inflicts [regular damage]{mechanic:regular-damage}. This move can only be used if each of the user's other moves has been used at least once since the user entered the [field]{mechanic:field}. If this is the user's only move, this move will [fail]{mechanic:fail}."
248,Changes the target's ability to Insomnia.,Changes the target's ability to []{ability:insomnia}.
249,Only works if the target is about to use a damaging move.,"Inflicts [regular damage]{mechanic:regular-damage}. If the target has not selected a damaging move this turn, or if the target has already acted this turn, this move will [fail]{mechanic:fail}."
250,Scatters poisoned spikes,"poisoning opposing Pokémon that switch in."",""Scatters poisoned spikes around the opposing [field]{mechanic:field}, which [poison]{mechanic:poison} opposing Pokémon that enter the [field]{mechanic:field}. A second layer of these spikes may be laid down, in which case Pokémon will be [badly poison]{mechanic:badly-poison}ed instead. Pokémon immune to either []{type:ground} moves or being [poison]{mechanic:poison}ed are immune to this effect. Pokémon otherwise immune to []{type:ground} moves are affected during []{move:gravity}."
251,User and target swap stat changes.,User swaps its [stat modifiers]{mechanic:stat-modifiers} with the target.
252,Restores 1/16 of the user's max HP each turn.,"Restores 1/16 of the user's max [HP]{mechanic:hp} at the end of each turn. If the user leaves the [field]{mechanic:field}, this effect ends."
253,User is immune to Ground moves and effects for five turns.,"For five turns, the user is immune to []{type:ground} moves."
254,User takes 1/3 the damage inflicted in recoil. Has a $effect_chance% chance to [burn]{mechanic:burn} the target.,"Inflicts [regular damage]{mechanic:regular-damage}. User takes 1/3 the damage it inflicts in recoil. Has a $effect_chance% chance to [burn]{mechanic:burn} the target. [Frozen]{mechanic:frozen} Pokémon may use this move, in which case they will thaw."
255,User takes 1/4 its max HP in recoil.,Inflicts [typeless]{mechanic:typeless} [regular damage]{mechanic:regular-damage}. User takes 1/4 its max [HP]{mechanic:hp} in recoil. Ignores [accuracy]{mechanic:accuracy} and [evasion]{mechanic:evasion} modifiers.
256,User dives underwater,"dodging all attacks, and hits next turn."",""Inflicts [regular damage]{mechanic:regular-damage}. User dives underwater for one turn, becoming immune to attack, and hits on the second turn."
257,User digs underground,"dodging all attacks, and hits next turn."",""Inflicts [regular damage]{mechanic:regular-damage}. User digs underground for one turn, becoming immune to attack, and hits on the second turn."
258,Inflicts regular damage and can hit Dive users.,Inflicts [regular damage]{mechanic:regular-damage}.
259,Lowers the target's evasion by one stage. Removes field effects from the enemy field.,"Lowers the target's [evasion]{mechanic:evasion} by one [stage]{mechanic:stage}. Clears away fog. Removes the effects of []{move:mist}, []{move:light-screen}, []{move:reflect}, []{move:safeguard}, []{move:spikes}, []{move:stealth-rock}, and []{move:toxic-spikes} from the target's side of the [field]{mechanic:field}."
260,For five turns,"slower Pokémon will act before faster Pokémon."",""For five turns (including this one), slower Pokémon will act before faster Pokémon. Move priority is not affected. Using this move when its effect is already active will end the effect."
261,Has a $effect_chance% chance to freeze the target.,Inflicts [regular damage]{mechanic:regular-damage}. Has a $effect_chance% chance to [freeze]{mechanic:freeze} the target.
262,Prevents the target from leaving battle and inflicts 1/16 its max HP in damage for 2-5 turns.,"Inflicts [regular damage]{mechanic:regular-damage}. For the next 2–5 turns, the target cannot leave the field and is damaged for 1/16 its max HP at the end of each turn. The user continues to use other moves during this time. If the user leaves the [field]{mechanic:field}, this effect ends."
263,User takes 1/3 the damage inflicted in recoil. Has a $effect_chance% chance to paralyze the target.,Inflicts [regular damage]{mechanic:regular-damage}. User takes 1/3 the damage it inflicts in recoil. Has a $effect_chance% chance to [paralyze]{mechanic:paralyze} the target.
264,User bounces high into the air,"dodging all attacks, and hits next turn."",""Inflicts [regular damage]{mechanic:regular-damage}. User bounces high into the air for one turn, becoming immune to attack, and hits on the second turn. Has a $effect_chance% chance to [paralyze]{mechanic:paralyze} the target."
266,Lowers the target's Special Attack by two stages if it's the opposite gender.,"Lowers the target's [Special Attack]{mechanic:special-attack} by two [stages]{mechanic:stage}. If the user and target are the same gender, or either is genderless, this move will [fail]{mechanic:fail}."
267,Causes damage when opposing Pokémon switch in.,"Spreads sharp rocks around the opposing [field]{mechanic:field}, damaging any Pokémon that enters the [field]{mechanic:field} for 1/8 its max [HP]{mechanic:hp}. This damage is affected by the entering Pokémon's susceptibility to []{type:rock} moves."
268,Has a higher chance to confuse the target when the recorded sound is louder.,"Inflicts [regular damage]{mechanic:regular-damage}. Has either a 1%, 11%, or 31% chance to [confuse]{mechanic:confuse} the target, based on the volume of the recording made for this move"
269,If the user is holding a appropriate plate or drive,"the damage inflicted will match it."",""Inflicts [regular damage]{mechanic:regular-damage}. If the user is holding a plate or a drive, this move's type is the type corresponding to that item."
270,User receives 1/2 the damage inflicted in recoil.,Inflicts [regular damage]{mechanic:regular-damage}. User takes 1/2 the damage it inflicts in recoil.
271,User faints,"and its replacement is fully healed."",""User [faint]{mechanic:faint}s. Its replacement's [HP]{mechanic:hp} and [PP]{mechanic:pp} are fully restored, and any [major status effect]{mechanic:major-status-effect} is removed."
272,Has a $effect_chance% chance to lower the target's Special Defense by two stages.,Inflicts [regular damage]{mechanic:regular-damage}. Has a $effect_chance% chance to lower the target's [Special Defense]{mechanic:special-defense} by two [stages]{mechanic:stage}.
273,User vanishes,"dodging all attacks, and hits next turn. Hits through Protect and Detect."",""Inflicts [regular damage]{mechanic:regular-damage}. User vanishes for one turn, becoming immune to attack, and hits on the second turn."
274,Has a $effect_chance% chance to [burn]{mechanic:burn} the target and a $effect_chance% chance to make the target flinch.,Inflicts [regular damage]{mechanic:regular-damage}. Has a $effect_chance% chance to [burn]{mechanic:burn} the target and a separate $effect_chance% chance to make the target [flinch]{mechanic:flinch}.
275,Has a $effect_chance% chance to freeze the target and a $effect_chance% chance to make the target flinch.,Inflicts [regular damage]{mechanic:regular-damage}. Has a $effect_chance% chance to [freeze]{mechanic:freeze} the target and a separate $effect_chance% chance to make the target [flinch]{mechanic:flinch}.
276,Has a $effect_chance% chance to paralyze the target and a $effect_chance% chance to make the target flinch.,Inflicts [regular damage]{mechanic:regular-damage}. Has a $effect_chance% chance to [paralyze]{mechanic:paralyze} the target and a separate $effect_chance% chance to make the target [flinch]{mechanic:flinch}.
277,Has a $effect_chance% chance to raise the user's Special Attack by one stage.,Inflicts [regular damage]{mechanic:regular-damage}. Has a $effect_chance% chance to raise the user's [Special Attack]{mechanic:special-attack} by one [stage]{mechanic:stage}.
278,Raises the user's Attack and accuracy by one stage.,Raises the user's [Attack]{mechanic:attack} and [accuracy]{mechanic:accuracy} by one [stage]{mechanic:stage}.
279,Prevents any multi-target moves from hitting friendly Pokémon this turn.,"Moves with multiple targets will not hit friendly Pokémon for the remainder of this turn. If the user is last to act this turn, this move will [fail]{mechanic:fail}."
280,Averages Defense and Special Defense with the target.,Averages the user's unmodified [Defense]{mechanic:defense} with the target's unmodified Defense
281,Averages Attack and Special Attack with the target.,Averages the user's unmodified [Attack]{mechanic:attack} with the target's unmodified Attack
282,All Pokémon's Defense and Special Defense are swapped for 5 turns.,"For five turns (including this one), every Pokémon's [Defense]{mechanic:defense} and [Special Defense]{mechanic:special-defense} are swapped."
283,Inflicts damage based on the target's Defense,"not Special Defense."",""Inflicts [regular damage]{mechanic:regular-damage}. Damage calculation always uses the target's [Defense]{mechanic:defense}, regardless of this move's damage class."
284,Inflicts double damage if the target is Poisoned.,"Inflicts [regular damage]{mechanic:regular-damage}. If the target is [poisoned]{mechanic:poisoned}, this move has double power."
285,Raises the user's Speed by two stages and halves the user's weight.,Raises the user's [Speed]{mechanic:speed} by two [stages]{mechanic:stage}. Halves the user's weight
286,Moves have 100% accuracy against the target for three turns.,"For three turns (including this one), moves used against the target have 100% [accuracy]{mechanic:accuracy}, but the target is immune to []{type:ground} damage. Accuracy of one-hit KO moves is exempt from this effect."
287,Negates held items for five turns.,"For five turns (including this one), passive effects of held items are ignored, and Pokémon will not use their held items."
288,Removes any immunity to Ground damage.,"Inflicts [regular damage]{mechanic:regular-damage}. Removes the target's [immunity]{mechanic:immune} to []{type:ground}-type damage. This effect removes any existing Ground immunity due to []{ability:levitate}, []{move:magnet-rise}, or []{move:telekinesis}, and causes the target's []{type:flying} type to be ignored when it takes Ground damage."
289,Always scores a critical hit.,Inflicts [regular damage]{mechanic:regular-damage}. Always scores a [critical hit]{mechanic:critical-hit}.
290,Deals splash damage to Pokémon next to the target.,"Inflicts [regular damage]{mechanic:regular-damage}. If this move successfully hits the target, any Pokémon adjacent to the target are damaged for 1/16 their max [HP]{mechanic:hp}."
291,Raises the user's Special Attack,"Special Defense, and Speed by one stage each."",""Raises the user's [Special Attack]{mechanic:special-attack}, [Special Defense]{mechanic:special-defense}, and [Speed]{mechanic:speed} by one [stage]{mechanic:stage} each."
292,Power is higher when the user weighs more than the target,"up to a maximum of 120."",""Inflicts [regular damage]{mechanic:regular-damage}. The greater the user's weight compared to the target's, the higher power this move has, to a maximum of 120."
293,Hits any Pokémon that shares a type with the user.,"Inflicts [regular damage]{mechanic:regular-damage}. Only Pokémon that share a type with the user will take damage from this move. 294,Power is higher when the user has greater Speed than the target, up to a maximum of 150."",""Inflicts [regular damage]{mechanic:regular-damage}. The greater the user's [Speed]{mechanic:speed} compared to the target's, the higher power this move has, to a maximum of 150."
295,Changes the target's type to Water.,"Changes the target to pure []{type:water}-type until it leaves the field. If the target has []{ability:multitype}, this move will [fail]{mechanic:fail}."
296,Inflicts regular damage. Raises the user's Speed by one stage.,Inflicts [regular damage]{mechanic:regular-damage}. Raises the user's [Speed]{mechanic:speed} by one [stage]{mechanic:stage}.
297,Lowers the target's Special Defense by two stages.,Inflicts [regular damage]{mechanic:regular-damage}. Lowers the target's [Special Defense]{mechanic:special-defense} by two [stages]{mechanic:stage}.
298,Calculates damage with the target's attacking stat.,Inflicts [regular damage]{mechanic:regular-damage}. Damage is calculated using the target's attacking stat rather than the user's.
299,Changes the target's ability to Simple.,Changes the target's ability to []{ability:simple}.
300,Copies the user's ability onto the target.,Changes the target's ability to match the user's. This effect ends when the target leaves battle.
301,Makes the target act next this turn.,"The target will act next this turn, regardless of [Speed]{mechanic:speed} or move priority."
302,Has double power if it's used more than once per turn.,"Inflicts [regular damage]{mechanic:regular-damage}. If []{move:round} has already been used this turn, this move's power is doubled. After this move is used, any other Pokémon using it this turn will immediately do so (in the order they would otherwise act), regardless of [Speed]{mechanic:speed} or priority. Pokémon using other moves will then continue to act as usual."
303,Power increases by 100% for each consecutive use by any friendly Pokémon,"to a maximum of 200."",""Inflicts [regular damage]{mechanic:regular-damage}. If any friendly Pokémon used this move earlier this turn or on the previous turn, that use's power is added to this move's power, to a maximum of 200."
304,Ignores the target's stat modifiers.,"Inflicts [regular damage]{mechanic:regular-damage}. Damage calculation ignores the target's [stat modifiers]{mechanic:stat-modifiers}, including [evasion]{mechanic:evasion}."
305,Removes all of the target's stat modifiers.,Inflicts [regular damage]{mechanic:regular-damage}. All of the target's [stat modifiers]{mechanic:stat-modifiers} are reset to zero.
306,Power is higher the more the user's stats have been raised,"to a maximum of 31×."",""Inflicts [regular damage]{mechanic:regular-damage}. Power is increased by 100% its original value for every [stage]{mechanic:stage} any of the user's stats have been raised. [Accuracy]{mechanic:accuracy}, [evasion]{mechanic:evasion}, and lowered stats do not affect this move's power. For a Pokémon with all five stats modified to +6, this move's power is 31×."
307,Prevents any priority moves from hitting friendly Pokémon this turn.,"Moves with priority greater than 0 will not hit friendly Pokémon for the remainder of this turn. If the user is last to act this turn, this move will [fail]{mechanic:fail}."
308,User switches places with the friendly Pokémon opposite it.,"User switches position on the field with the friendly Pokémon opposite it. If the user is in the middle position in a triple battle, or there are no other friendly Pokémon, this move will [fail]{mechanic:fail}."
309,Raises user's Attack,"Special Attack, and Speed by two stages. Lower user's Defense and Special Defense by one stage."",""Raises the user's [Attack]{mechanic:attack}, [Special Attack]{mechanic:special-attack}, and [Speed]{mechanic:speed} by two [stages]{mechanic:stage} each. Lowers the user's [Defense]{mechanic:defense} and [Special Defense]{mechanic:special-defense} by one []{mechanic:stage} each."
310,Heals the target for half its max HP.,Heals the target for half its max [HP]{mechanic:hp}.
311,Has double power if the target has a major status ailment.,"Inflicts [regular damage]{mechanic:regular-damage}. If the target has a [major status ailment]{mechanic:major-status-ailment}, this move has double power."
312,Carries the target high into the air,"dodging all attacks against either, and drops it next turn."",""Inflicts [regular damage]{mechanic:regular-damage}. User carries the target high into the air for one turn, during which no moves will hit either Pokémon and neither can act. On the following turn, the user drops the target, inflicting damage and ending the effect."
313,Raises the user's Attack by one stage and its Speed by two stages.,Raises the user's [Attack]{mechanic:attack} by one [stage]{mechanic:stage} and its [Speed]{mechanic:speed} by two stages.
314,Ends wild battles. Forces trainers to switch Pokémon.,"Inflicts [regular damage]{mechanic:regular-damage}, then [switches]{mechanic:switch-out} the target out for another of its trainer's Pokémon, selected at random."
315,Destroys the target's held berry.,"Inflicts [regular damage]{mechanic:regular-damage}. If the target is [holding]{mechanic:held-item} a [berry]{mechanic:berry}, it's destroyed and cannot be used in response to this move."
316,Makes the target act last this turn.,"Forces the target to act last this turn, regardless of [Speed]{mechanic:speed} or move [priority]{mechanic:priority}. If the target has already acted this turn, this move will [fail]{mechanic:fail}."
317,Raises the user's Attack and Special Attack by one stage.,"Raises the user's [Attack]{mechanic:attack} and [Special Attack]{mechanic:special-attack} by one [stage]{mechanic:stage} each. During []{move:sunny-day}, raises both stats by two stages."
318,Has double power if the user has no held item.,"Inflicts [regular damage]{mechanic:regular-damage}. If the user has no [held item]{mechanic:held-item}, this move has double power."
319,User becomes the target's type.,User's type changes to match the target's.
320,Has double power if a friendly Pokémon fainted last turn.,"Inflicts [regular damage]{mechanic:regular-damage}. If a friendly Pokémon fainted on the previous turn, this move has double power."
321,Inflicts damage equal to the user's remaining HP. User faints.,Inflicts damage equal to the user's remaining [HP]{mechanic:hp}. User faints.
322,Raises the user's Special Attack by three stages.,Raises the user's [Special Attack]{mechanic:special-attack} by three [stages]{mechanic:stage}.
323,Raises the user's Attack,"Defense, and accuracy by one stage each."",""Raises the user's [Attack]{mechanic:attack}, [Defense]{mechanic:defense}, and [accuracy]{mechanic:accuracy} by one [stage]{mechanic:stage} each."
324,Gives the user's held item to the target.,"Transfers the user's [held item]{mechanic:held-item} to the target. If the user has no held item, or the target already has a held item, this move will [fail]{mechanic:fail}."
325,With [Grass Pledge]{move:grass-pledge},"halves opposing Pokémon's Speed for four turns."",""Inflicts [regular damage]{mechanic:regular-damage}. If a friendly Pokémon used []{move:grass-pledge} earlier this turn, all opposing Pokémon have halved [Speed]{mechanic:speed} for four turns (including this one)."
326,With [Water Pledge]{move:water-pledge},"doubles the effect chance of friendly Pokémon's moves for four turns."",""Inflicts [regular damage]{mechanic:regular-damage}. If a friendly Pokémon used []{move:water-pledge} earlier this turn, moves used by any friendly Pokémon have doubled effect chance for four turns (including this one)."
327,With [Fire Pledge]{move:fire-pledge},"damages opposing Pokémon for 1/8 their max HP every turn for four turns."",""Inflicts [regular damage]{mechanic:regular-damage}. If a friendly Pokémon used []{move:fire-pledge} earlier this turn, all opposing Pokémon will take 1/8 their max [HP]{mechanic:hp} in damage at the end of every turn for four turns (including this one)."
328,Raises the user's Attack and Special Attack by one stage each.,Raises the user's [Attack]{mechanic:attack} and [Special Attack]{mechanic:special-attack} by one [stage]{mechanic:stage} each.
329,Raises the user's Defense by three stages.,Raises the user's [Defense]{mechanic:defense} by three [stages]{mechanic:stage}.
330,Has a $effect_chance% chance to put the target to sleep.,Inflicts [regular damage]{mechanic:regular-damage}. Has a $effect_chance% chance to put the target to [sleep]{mechanic:sleep}.
331,Lowers the target's Speed by one stage.,Inflicts [regular damage]{mechanic:regular-damage}. Lowers the target's [Speed]{mechanic:speed} by one [stage]{mechanic:stage}.
332,Requires a turn to charge before attacking. Has a $effect_chance% chance to paralyze the target.,Inflicts [regular damage]{mechanic:regular-damage}. Has a $effect_chance% chance to [paralyze]{mechanic:paralysis} the target. User charges for one turn before attacking.
333,Requires a turn to charge before attacking. Has a $effect_chance% chance to [burn]{mechanic:burn} the target.,Inflicts [regular damage]{mechanic:regular-damage}. Has a $effect_chance% chance to [burn]{mechanic:burn} the target. User charges for one turn before attacking.
334,Has a $effect_chance% chance to confuse the target.,Inflicts [regular damage]{mechanic:regular-damage}. Has a $effect_chance% chance to [confuse]{mechanic:confuse} the target.
335,Lowers the user's Defense,"Special Defense, and Speed by one stage each."",""Inflicts [regular damage]{mechanic:regular-damage}. Lowers the user's [Defense]{mechanic:defense}, [Special Defense]{mechanic:special-defense}, and [Speed]{mechanic:speed} by one [stage]{mechanic:stage} each."
336,With [Fusion Bolt]{move:fusion-bolt},"inflicts double damage."",""Inflicts [regular damage]{mechanic:regular-damage}. If a friendly Pokémon used []{move:fusion-bolt} earlier this turn, this move has double power."
337,With [Fusion Flare]{move:fusion-flare},"inflicts double damage."",""Inflicts [regular damage]{mechanic:regular-damage}. If a friendly Pokémon used []{move:fusion-flare} earlier this turn, this move has double power."
338,Deals both []{type:fighting} and []{type:flying}-type damage.,"Inflicts regular damage. For the purposes of type effectiveness, this move is both []{type:fighting}- and []{type:flying}-type: its final effectiveness is determined by multiplying the effectiveness of each type against each of the target's types."
339,Can only be used after the user has eaten a berry.,Inflicts regular damage. Can only be used if the user has eaten a berry since the beginning of the battle.
340,Raises the Attack and Special Attack of all []{type:grass} Pokémon in battle.,Raises the Attack and Special Attack of all []{type:grass} Pokémon in battle.
341,Covers the opposing field,"lowering opponents' Speed by one stage upon switching in."",""Shoots a web over the opponents' side of the field, which lowers the Speed of any opposing Pokémon that enters the field by one stage."
342,Raises the user's Attack by two stages if it KOs the target.,Inflicts regular damage. Raises the user's Attack by two stages if it KOs the target.
343,Adds []{type:ghost} to the target's types.,Adds []{type:ghost} to the target's types.
344,Lowers the target's Attack and Special Attack by one stage.,Lowers the target's Attack and Special Attack by one stage.
345,Changes all []{type:normal} moves to []{type:electric} moves for the rest of the turn.,Changes all Pokémon's []{type:normal} moves to []{type:electric} moves for the rest of the turn.
346,Heals the user for half the total damage dealt to all targets.,Heals the user for half the total damage dealt to all targets.
347,Lowers all targets' Attack and Special Attack by one stage. Makes the user switch out.,Lowers all targets' Attack and Special Attack by one stage. Makes the user switch out.
348,Inverts the target's stat modifiers.,Inverts the target's stat modifiers.
