id,short_effect,effect
349,Drains 75% of the damage inflicted to heal the user.,Deals regular damage. Drains 75% of the damage inflicted to heal the user.
350,Protects all friendly Pokémon from non-damaging moves.,Protects all friendly Pokémon from non-damaging moves for the rest of the turn.
351,Raises the Defense of all []{type:grass} Pokémon in battle.,Raises the Defense of all []{type:grass} Pokémon in battle.
352,For five turns,"heals all Pokémon on the ground for 1/16 max HP each turn and strengthens their []{type:grass} moves to 1.5× their power."",""For five turns, heals all Pokémon on the ground for 1/16 their max HP each turn and strengthens their []{type:grass} moves to 1.5× their power."
353,For five turns,"protects all Pokémon on the ground from major status ailments and confusion, and halves the power of incoming []{type:dragon} moves."",""For five turns, protects all Pokémon on the ground from major status ailments and confusion and weakens []{type:dragon} moves used against them to 0.5× their power."
354,Changes the target's move's type to []{type:electric} if it hasn't moved yet this turn.,Changes the target's move's type to []{type:electric} if it hasn't moved yet this turn.
355,Prevents all Pokémon from fleeing or switching out during the next turn.,Prevents all Pokémon from fleeing or switching out during the next turn.
356,Blocks damaging attacks and lowers attacking Pokémon's Attack by two stages on contact. Switches Aegislash to Shield Forme.,Blocks damaging attacks and lowers attacking Pokémon's Attack by two stages on contact. Switches Aegislash to Shield Forme.
357,Lowers the target's Attack by one stage.,Lowers the target's [Attack]{mechanic:attack} by one [stage]{mechanic:stage}.
358,Lowers the target's Special Attack by one stage.,Lowers the target's Special Attack by one stage.
359,Has a $effect_chance% chance to raise the user's Defense by two stages for each target hit.,Inflicts regular damage. Has a $effect_chance% chance to raise the user's Defense by two stages for each target hit.
360,Ignores and destroys protection effects.,Inflicts [regular damage]{mechanic:regular-damage}. Bypasses and removes any protection effect on the target.
361,Hits 2–5 times.,Inflicts regular damage. Hits 2–5 times.
362,Blocks damaging attacks and damages attacking Pokémon for 1/8 their max HP.,Blocks damaging attacks and damages attacking Pokémon for 1/8 their max HP.
363,Raises a selected ally's Special Defense by one stage.,Raises a selected ally's Special Defense by one stage.
364,Lowers the target's Attack,"Special Attack, and Speed by one stage if it is poisoned."",""Lowers the target's Attack, Special Attack, and Speed by one stage if it is poisoned."
365,Lowers the target's Attack by one stage.,Lowers the target's Attack by one stage.
366,Takes one turn to charge,"then raises the user's Special Attack, Special Defense, and Speed by two stages."",""Takes one turn to charge, then raises the user's Special Attack, Special Defense, and Speed by two stages."
367,Raises the Defense and Special Defense of all friendly Pokémon with []{ability:plus} or []{ability:minus} by one stage.,Raises the Defense and Special Defense of all friendly Pokémon with []{ability:plus} or []{ability:minus} by one stage.
368,Doubles prize money.,Doubles prize money.
369,For five turns,"prevents all Pokémon on the ground from sleeping and strengthens their []{type:electric} moves to 1.5× their power."",""For five turns, prevents all Pokémon on the ground from sleeping and strengthens their []{type:electric} moves to 1.5× their power."
370,Does nothing.,Does nothing.
371,Does nothing.,Does nothing.
372,Has a $effect_chance% chance to paralyze the target.,Inflicts [regular damage]{mechanic:regular-damage}. Has a $effect_chance% chance to [paralyze]{mechanic:paralysis} the target.
373,Grounds the target,"and hits even Flying-type or levitating Pokémon."",Inflicts regular damage. Grounds the target until it leaves battle. Ignores levitation effects and the immunity of []{type:flying}-type Pokémon."
374,Prevents the target from leaving battle.,Inflicts regular damage. Traps the target.
375,Raises the user's Attack by one stage after inflicting damage.,Inflicts regular damage. Raises the user's Attack by one stage.
376,Adds []{type:grass} to the target's types.,Adds []{type:grass} to the target's types.
377,Protects all friendly Pokémon from damaging moves. Only works on the first turn after the user is sent out.,Protects all friendly Pokémon from damaging moves. Only works on the first turn after the user is sent out.
378,Explodes if the target uses a []{type:fire} move this turn,"damaging it for 1/4 its max HP and preventing the move."",""Explodes if the target uses a []{type:fire} move this turn, damaging it for 1/4 its max HP and preventing the move."
379,Inflicts regular damage.,Inflicts [regular damage]{mechanic:regular-damage}.
380,Super-effective against []{type:water}.,Inflicts [regular damage]{mechanic:regular-damage}. This move is super-effective against the []{type:water} type.
381,Never misses.,Inflicts [regular damage]{mechanic:regular-damage}. Ignores [accuracy]{mechanic:accuracy} and [evasion]{mechanic:evasion}.
382,Heals the user for ½ its max HP,"or ⅔ during a sandstorm."",""Heals the user for ½ its max HP. During a []{move:sandstorm}, the healing is increased to ⅔."
383,Can only be used as the first move after the user enters battle.,Inflicts regular damage. Can only be used on the user's first turn after entering the field.
384,Grants the user protection for the rest of the turn and poisons any Pokémon that tries to use a contact move on it.,"Grants the user protection for the rest of the turn. If a Pokémon attempts to use a move that makes contact with the user, that Pokémon will be poisoned. This move's chance of success halves every time it's used consecutively with any other protection move."
385,Traps the target.,Inflicts regular damage. Traps the target.
386,Cures the target of burns.,"Inflicts regular damage. If the target has a burn and takes damage from this move, its burn is healed."
387,Heals the target for ½ its max HP,"or ⅔ on Grassy Terrain."",""Heals the target for ½ its max HP. If []{move:grassy-terrain} is in effect, heals for ⅔ instead."
388,Heals the user by the target's current Attack stat and lowers the target's Attack by one stage.,"Lowers the target's Attack by one stage. Heals the user by the target's current Attack, including modifiers, but not including this move's Attack-lowering effect."
6,this move will fail. In any other situation that would prevent a stat modification,the healing will still succeed.
389,Forces the target's opponents to aim at the target for the rest of the turn.,"For the duration of the turn, if the target is also a valid target for a move used by one of its opponents, that move will target it instead."
390,Poisons the target and lowers its Speed by one stage.,Poisons the target and lowers its Speed by one stage.
391,Guarantees a critical hit with the user's next move.,The user's next move will result in a [critical hit]{mechanic:critical-hit}.
392,Raises the Attack and Special Attack of all friendly Pokémon with []{ability:plus} or []{ability:minus} by one stage.,Raises the Attack and Special Attack of all friendly Pokémon with []{ability:plus} or []{ability:minus} by one stage.
393,Prevents the target from using sound-based moves for two turns.,"Inflicts [regular damage]{mechanic:regular-damage}. Silences the target for two turns, preventing it from using any sound-based moves."
394,Damages opponents,"but heals allies for 50% of their max HP."",""If the target is an opponent, inflicts [regular damage]{mechanic:regular-damage}. If the target is an ally, heals the target for 50% of its max HP."
395,Protects Pokémon on the ground from priority moves and increases the power of their Psychic moves by 50%.,"Changes the terrain to Psychic Terrain for 5 turns. Overrides []{move:electric-terrain}, []{move:grassy-terrain}, and []{move:misty-terrain}."
396,Lowers the target's Attack by one stage after inflicting damage.,Inflicts [regular damage]{mechanic:regular-damage}. Lowers the target's [Attack]{mechanic:attack} by one [stage]{mechanic:stage}.
397,Lowers the target's Defense by one stage after inflicting damage.,Inflicts [regular damage]{mechanic:regular-damage}. Lowers the target's [Defense]{mechanic:defense} by one [stage]{mechanic:stage}.
398,Removes the user's []{type:fire} type after inflicting damage.,"Inflicts [regular damage]{mechanic:regular-damage}. Removes the user's []{type:fire} type after damage calculation. If the user is not []{type:fire}-type, this move will fail."
399,Exchanges the user's Speed with the target's.,Exchanges the original [Speed]{mechanic:speed} stats of the user and target.
400,Cures the target of a major status ailment and heals the user for 50% of its max HP.,"Cures the target of its major status ailment and heals the user for 50% of its max HP. If the target has no major status ailment, this move will fail."
401,Has the same type as the user.,"Inflicts [regular damage]{mechanic:regular-damage}. This move's type matches the user's first type, if any"
402,Nullifies the target's ability if it moves earlier.,"Inflicts [regular damage]{mechanic:regular-damage}. If the target has already moved this turn, its ability is nullified."
403,Forces the target to repeat its last used move.,"The target immediately uses its most recently-used move. This is independent of the target's normal action for the turn (i.e., it may end up moving twice), but otherwise functions as usual, including deduction of PP. This effect works for disabled moves and ignores []{move:torment}."
404,Inflicts a burn on any Pokémon that makes contact before the attack.,"Begins charging at the start of the turn, then attacks as normal. Any Pokémon that makes contact with the user while charging is [burned]{mechanic:burns}. The charging is not affected by accuracy, sleep, paralysis, or any other effect that would interfere with a move."
405,Lowers the user's Defense by one stage after inflicting damage.,Inflicts [regular damage]{mechanic:regular-damage}. Lowers the user's [Defense]{mechanic:defense} by one [stage]{mechanic:stage}.
406,Inflicts regular damage with no additional effect.,Inflicts [regular damage]{mechanic:regular-damage}.
407,Reduces damage five turns,"but must be used during hail."",""Places the Aurora Veil effect on the user's side of the field for the next 5 turns. If the weather is not []{move:hail}, or the weather is disabled by the effects of []{ability:cloud-nine} or []{ability:air-lock}, this move will fail."
408,Only inflicts damage if the user was hit by a physical move this turn.,"Inflicts [regular damage]{mechanic:regular-damage}. If the user was not yet hit by an opponent's physical move this turn, this move will fail."
409,Has double power if the user's last move failed.,"Inflicts [regular damage]{mechanic:regular-damage}. Power is doubled if the user's last move failed for any reason (i.e., produced the message """"But it failed!"""") or was ineffective due to types."
410,Steals the target's stat increases,"then inflicts damage."",""Steals the target's stat increases, then inflicts [regular damage]{mechanic:regular-damage}. Will not steal stat increases that would put any of the user's stats at more than +6"
411,Cannot be disrupted by abilities.,"Inflicts [regular damage]{mechanic:regular-damage}. Other Pokémon's abilities cannot activate in response to this move. In particular, it hits through []{ability:disguise}"
412,Lowers the target's Attack and Special Attack by one stage.,Lowers the target's [Attack]{mechanic:attack} and [Special Attack]{mechanic:special-attack} by one stage each.
413,Damages the target for 75% of its remaining HP.,Inflicts direct damage equal to ¾ of the target's remaining HP.
414,Raises all of the user's stats by two stages.,"Raises the user's [Attack]{mechanic:attack}, [Defense]{mechanic:defense}, [Special Attack]{mechanic:special-attack}, [Special Defense]{mechanic:special-defense}, and [Speed]{mechanic:speed} by two [stages]{mechanic:stage} each."
415,Changes the terrain to Psychic Terrain after inflicting damage.,"Inflicts [regular damage]{mechanic:regular-damage}, then (if successful) changes the terrain to []{move:psychic-terrain}."
416,XXX new effect for light-that-burns-the-sky,XXX new effect for light-that-burns-the-sky
417,XXX new effect for lets-snuggle-forever,XXX new effect for lets-snuggle-forever
418,XXX new effect for splintered-stormshards,XXX new effect for splintered-stormshards
419,XXX new effect for clangorous-soulblaze,XXX new effect for clangorous-soulblaze
420,XXX new effect for mind-blown,XXX new effect for mind-blown
421,XXX new effect for dynamax-cannon,XXX new effect for dynamax-cannon
422,XXX new effect for snipe-shot,XXX new effect for snipe-shot
423,XXX new effect for jaw-lock,XXX new effect for jaw-lock
424,XXX new effect for stuff-cheeks,XXX new effect for stuff-cheeks
425,XXX new effect for no-retreat,XXX new effect for no-retreat
426,XXX new effect for tar-shot,XXX new effect for tar-shot
427,XXX new effect for magic-powder,XXX new effect for magic-powder
428,XXX new effect for dragon-darts,XXX new effect for dragon-darts
429,XXX new effect for teatime,XXX new effect for teatime
430,XXX new effect for octolock,XXX new effect for octolock
431,XXX new effect for bolt-beak,XXX new effect for bolt-beak
432,XXX new effect for court-change,XXX new effect for court-change
433,XXX new effect for clangorous-soul,XXX new effect for clangorous-soul
434,XXX new effect for body-press,XXX new effect for body-press
435,XXX new effect for decorate,XXX new effect for decorate
436,XXX new effect for behemoth-blade,XXX new effect for behemoth-blade
437,XXX new effect for aura-wheel,XXX new effect for aura-wheel
439,XXX new effect for overdrive,XXX new effect for overdrive
440,XXX new effect for apple-acid,XXX new effect for apple-acid
441,XXX new effect for life-dew,XXX new effect for life-dew
442,XXX new effect for obstruct,XXX new effect for obstruct
10001,Has an increased chance for a critical hit in Hyper Mode.,Inflicts [regular damage]{mechanic:regular-damage}. User's [critical hit]{mechanic:critical-hit} rate is one level higher when using this move while in [hyper mode]{mechanic:hyper-mode}.
10002,User receives 1/2 its HP in recoil.,Inflicts [regular damage]{mechanic:regular-damage}. User takes 1/2 of its current [HP]{mechanic:hp} in recoil.
10003,Halves HP of all Pokémon on the field. Must recharge,"Halves [HP]{mechanic:hp} of all Pokémon on the field. User loses its next turn to """"recharge"""", and cannot attack or [switch]{mechanic:switch} out during that turn."
10004,Lowers the target's evasion by two stages.,Lowers the target's [evasion]{mechanic:evasion} by two [stages]{mechanic:stage}.
10005,Removes [Light Screen]{move:light-screen},"[Reflect]{move:reflect}, and [Safeguard]{move:safeguard}."",""Removes the effects of []{move:light-screen}, []{move:reflect}, and []{move:safeguard}."
10006,Changes the weather to Shadow Sky for five turns.,Changes the weather to Shadow Sky for five turns. Pokémon other than []{type:shadow} Pokémon take 1/16 their max [HP]{mechanic:hp} at the end of every turn. This move is typeless for the purposes of []{move:weather-ball}.
